{
  "schema_version": "1.0", "window_start": "2026-08-29T14:00:00Z", "window_end": "2026-08-29T14:05:00Z", "dimensions": {"provider_id": "stripe", "country": "BR"}, "eligible_attempts": 492, "approved_attempts": 251, "unique_payments": 470, "approved_payments": 258, "amount_minor": 7342000, "currency": "BRL", "approval_rate": 0.5102, "payment_conversion": 0.5489, "latency_p50_ms": 1100, "latency_p95_ms": 4100, "timeout_rate": 0.28, "decline_counts": {"PROVIDER_TIMEOUT": 169, "PROVIDER_INTERNAL_ERROR": 72}, "data_quality": 0.98, "window_revision": 1, "correlation_id": "corr_window_001"
}
